{
  "cert_id": "root-b-decompositions",
  "root_node": "ledger:reports/decompositions.json",
  "root_falsification_kind": "ledger_stale",
  "closure": [
    "claim:README.md#Repository layout",
    "claim:docs/BACKLOG.md#Cognitive frames / lexical stores",
    "claim:docs/BACKLOG.md#Controller / harness",
    "claim:docs/BACKLOG.md#Parser / matcher",
    "claim:docs/BACKLOG.md#Remainder of the 12,681 unique-covered set needs a skeleton emitter",
    "claim:docs/BACKLOG.md#Schema",
    "claim:docs/BACKLOG.md#Verdict-backed ingestion should be a RULE, not a precedent (v0.10 item 2 review filing)",
    "claim:docs/BACKLOG.md#specialize.py is already minutes-scale at 508 nodes (v0.10 item 4)",
    "claim:docs/DESIGN-corpus-scale-and-programming.md#The claim this document makes",
    "claim:docs/DESIGN-epistemic-ladder.md#The ladder",
    "claim:docs/DESIGN-frames-and-retrieval.md#2. Retrieval as an action; UNKNOWN as its trigger",
    "claim:docs/DESIGN-frames-and-retrieval.md#Design: fictional frames and retrieval-as-action",
    "claim:docs/DESIGN-grounded-admission.md#3. Capability-blind baseline and vacuity",
    "claim:docs/DESIGN-grounded-admission.md#5. Reproducibility and artifact",
    "claim:docs/DESIGN-heldout-recovery.md#7. Cost, inherited and new",
    "claim:docs/DESIGN-item4-authoring.md#6. Fully-ground statements are not generals (disclosed, then implemented)",
    "claim:docs/DESIGN-language-as-structure.md#3. Correction: what “templates” actually are",
    "claim:docs/DESIGN-language-as-structure.md#5.3.4 Lexical semantics is load-bearing (and must have a source)",
    "claim:docs/DESIGN-live-session.md#11. v0.13 addendum — P-LS6 adjudication",
    "claim:docs/DESIGN-programming-discipline.md#4. How code becomes a statement node — no new matcher",
    "claim:docs/DESIGN-programming-discipline.md#5.2 Structural twin against a capability-blind baseline",
    "claim:docs/DESIGN-programming-discipline.md#7. Artifacts and layout",
    "claim:docs/DESIGN-programming-discipline.md#8. Registered predictions (floors), and what was already probed",
    "claim:docs/DESIGN-programming-discipline.md#9. Adjudication — after implementation",
    "claim:docs/DESIGN-programming-second-wave.md#4. How the new code becomes a statement — still no new matcher",
    "claim:docs/DESIGN-programming-second-wave.md#5.2 Structural twins against a keyword baseline",
    "claim:docs/DESIGN-programming-second-wave.md#8. Registered predictions (floors), and what was already probed",
    "claim:docs/DESIGN-programming-second-wave.md#9. Adjudication — after implementation",
    "claim:docs/DESIGN-programming-second-wave.md#Design — programming discipline, second wave (ROADMAP-v0.11 item 3)",
    "claim:docs/DESIGN-residual-proposer.md#5. v0.13 acceptance, exact enough to fail",
    "claim:docs/DESIGN-retraction-closure.md#3. Grounded against the record, including what the proposal got wrong",
    "claim:docs/DESIGN-retraction-closure.md#5. First slice",
    "claim:docs/DESIGN-retraction-closure.md#6a. Adjudication registration (2026-08-20, before the single scored run)",
    "claim:docs/DESIGN-retraction-closure.md#Clarification (2026-08-20, before any builder): who counts as a writer",
    "claim:docs/DESIGN-retraction-closure.md#Correction (2026-08-20, before any preregistration): the anchors moved",
    "claim:docs/DESIGN-scope-and-modality.md#1.4 Historical recommendation: (A) now, (B) later",
    "claim:docs/DESIGN-scope-and-modality.md#2.4 Groundedness, predicted",
    "claim:docs/DESIGN-self-grounding-ingestion.md#1. Where this came from (an accident, not a plan)",
    "claim:docs/DESIGN-self-grounding-ingestion.md#3. The measurement",
    "claim:docs/DESIGN-self-grounding-ingestion.md#5. What this rests on, and what it is not",
    "claim:docs/DESIGN-self-grounding-ingestion.md#6. Correction, before any measurement ran",
    "claim:docs/DESIGN-self-grounding-ingestion.md#7. A cost constraint the measurement inherits (from item 4, before it merged)",
    "claim:docs/DESIGN-self-grounding-ingestion.md#8. Route decision (v0.11, before implementation)",
    "claim:docs/DESIGN-self-grounding-ingestion.md#9. Adjudication (appended after the run; §1–§8 unedited)",
    "claim:docs/DESIGN-skeleton-emitter.md#4. Cost: ingested statements are not specialize / pattern endpoints",
    "claim:docs/DESIGN-skeleton-emitter.md#7. Adjudication — after the emitter and seed ran",
    "claim:docs/DESIGN-v010-harness-session.md#7. Adjudication — after implementation",
    "claim:docs/DESIGN-visual-structure.md#Splits",
    "claim:docs/DESIGN-when-to-ask.md#2. Representation before ranking",
    "claim:docs/DESIGN-when-to-ask.md#3. The fourth conversational holdout",
    "claim:docs/DISCOVERIES.md#Discoveries",
    "claim:docs/DISCOVERIES.md#Informative near-misses (kept deliberately)",
    "claim:docs/DISCOVERIES.md#v0.10 — the verifier, the inert middle, and a baseline that scaled badly (2026-08-13)",
    "claim:docs/RELEASE-v0.10.0.md#Assets",
    "claim:docs/RELEASE-v0.10.0.md#Reproduce",
    "claim:docs/RELEASE-v0.10.0.md#The second finding, which nobody designed for: ingestion compounds",
    "claim:docs/RELEASE-v0.11.0.md#Honest limits carried forward",
    "claim:docs/RELEASE-v0.12.0.md#Assets",
    "claim:docs/RELEASE-v0.13.0.md#Shipped",
    "claim:docs/RELEASE-v0.3.0.md#Shipped beyond the roadmap",
    "claim:docs/RELEASE-v0.4.0.md#See the improvement (Before → Now → Demonstrate)",
    "claim:docs/RELEASE-v0.4.0.md#The toolchain grew up — and audited itself",
    "claim:docs/RELEASE-v0.5.0.md#Reference frames use the same scope machinery",
    "claim:docs/RELEASE-v0.5.0.md#Reproduce from a fresh clone",
    "claim:docs/RELEASE-v0.5.0.md#Shipped",
    "claim:docs/RELEASE-v0.6.0.md#Release validation record",
    "claim:docs/RELEASE-v0.6.0.md#Reproduce from a fresh clone",
    "claim:docs/RELEASE-v0.7.0.md#Release validation record",
    "claim:docs/RELEASE-v0.7.0.md#Reproduce from a fresh clone",
    "claim:docs/RELEASE-v0.7.0.md#Shipped",
    "claim:docs/RELEASE-v0.7.0.md#The headline: single demonstrations became families with baselines",
    "claim:docs/RELEASE-v0.8.0.md#Release validation record",
    "claim:docs/RELEASE-v0.8.0.md#Reproduce from a fresh clone",
    "claim:docs/RELEASE-v0.9.0.md#Roadmap triage",
    "claim:docs/ROADMAP-v0.10.md#3. Programming as a first-class discipline (carried from v0.9 item 2)",
    "claim:docs/ROADMAP-v0.10.md#4. Author the covered subset, then recompute the ledgers on the enlarged graph",
    "claim:docs/ROADMAP-v0.11.md#1. Self-grounding ingestion, measured against a null (headline, forward-looking)",
    "claim:docs/ROADMAP-v0.14.md#1. Freeze the evaluator before the implementation (prerequisite)",
    "claim:docs/ROADMAP-v0.16.md#1. The retraction closure (headline, architecture)",
    "claim:docs/ROADMAP-v0.3.md#Deeper experiments (release-gating for v0.3)",
    "claim:docs/ROADMAP-v0.3.md#v0.3 roadmap — grounded composition",
    "claim:docs/ROADMAP-v0.4.md#Carried from v0.3 (designs intact)",
    "claim:docs/ROADMAP-v0.5.md#Carried (designs intact)",
    "claim:docs/ROADMAP-v0.6.md#11. Release gate",
    "claim:docs/ROADMAP-v0.7.md#10. Groundedness and release governance",
    "claim:docs/ROADMAP-v0.7.md#6. Retrieval becomes tool use",
    "claim:docs/ROADMAP-v0.8.md#7. Groundedness gains a gate, and reports gain coherence checks",
    "claim:docs/ROADMAP-v0.9.md#1. Make the corpus non-toy, by ingestion (headline)",
    "claim:docs/ROADMAP-v0.9.md#Release gate",
    "claim:docs/TRIAGE-v0.10.md#5. Forward-looking design for ROADMAP-v0.11 (release-skill requirement)",
    "claim:docs/TRIAGE-v0.11.md#1. Release gate",
    "claim:docs/TRIAGE-v0.11.md#5. Assets",
    "claim:docs/TRIAGE-v0.12.md#5. Assets",
    "claim:docs/blog/a-tiny-model-in-a-symbolic-world.md#Retrieval: using knowledge is ahead of seeking it",
    "claim:docs/blog/a-tiny-model-in-a-symbolic-world.md#Storage: durable knowledge, session state, and write-back",
    "claim:docs/blog/a-tiny-model-in-a-symbolic-world.md#Where the project stands",
    "claim:docs/blog/the-bag-still-wins.md#The thing nobody designed for",
    "claim:docs/blog/the-world-outside-the-weights.md#A lexical graph outside the model",
    "claim:experiments/ANALYSIS.md#Physical reference frames (v0.5 item 10b, first cut)",
    "claim:experiments/ANALYSIS.md#v0.10 item 3 — programming as a first-class discipline",
    "claim:experiments/ANALYSIS.md#v0.10 item 4 — first wave of covered ingest, and the baseline on hundreds",
    "claim:experiments/ANALYSIS.md#v0.10 item 5 — one real session, recorded: the ingested layer starts grounding itself (2026-08-12)",
    "claim:experiments/ANALYSIS.md#v0.11 prerequisite — skeleton emitter for the unique-covered remainder",
    "claim:experiments/ANALYSIS.md#v0.5 UNKNOWN-triggered retrieval adapter",
    "claim:experiments/ANALYSIS.md#v0.9 item 1 (cont.) — Lean-workbook grammar-coverage: the second source, at scale",
    "ledger:reports/decompositions.json"
  ],
  "closure_size": 106,
  "depth_histogram": {
    "0": 1,
    "1": 105
  },
  "unprovenanced_nodes": [
    "claim:README.md#Design documents",
    "claim:README.md#Measured findings (full narrative: `experiments/ANALYSIS.md`)",
    "claim:README.md#The models",
    "claim:README.md#corollary-abstractions",
    "claim:docs/BACKLOG.md#Backlog",
    "claim:docs/BACKLOG.md#Carrier table: ℝ≥0/NNReal subtraction is monus-family (v0.10 quantifier-slice review filing)",
    "claim:docs/BACKLOG.md#Frame registry",
    "claim:docs/BACKLOG.md#Interactive harness / agent OS",
    "claim:docs/BACKLOG.md#Language as structure (linguistic dual of the prover)",
    "claim:docs/BACKLOG.md#Nested frames",
    "claim:docs/BACKLOG.md#Parked at the v0.15 drift audit",
    "claim:docs/BACKLOG.md#Parked at v0.10.0 release triage (no named dependant in ROADMAP-v0.11)",
    "claim:docs/BACKLOG.md#Parked at v0.12 triage",
    "claim:docs/BACKLOG.md#Real-data lanes",